{
  "$schema": "./design-tokens.schema.json",
  "name": "LongClaw visual foundations",
  "version": "1.0.0",
  "description": "Canonical Phase 0 design-token source. Components consume the generated --lc-* custom properties and never literal accent hues.",
  "system": {
    "font-family-display": "\"Familjen Grotesk\", \"Avenir Next\", sans-serif",
    "font-family-ui": "\"Geist\", \"SF Pro Text\", -apple-system, BlinkMacSystemFont, sans-serif",
    "font-family-mono": "\"JetBrains Mono\", \"SFMono-Regular\", Consolas, monospace",
    "font-size-display": "26px",
    "font-size-title": "17px",
    "font-size-body": "13.5px",
    "font-size-ui": "13px",
    "font-size-small": "12.5px",
    "font-size-label": "11px",
    "font-size-code": "12px",
    "line-height-display": "32px",
    "line-height-title": "22px",
    "line-height-body": "20px",
    "line-height-ui": "18px",
    "line-height-small": "18px",
    "line-height-label": "16px",
    "line-height-code": "18px",
    "font-weight-regular": "400",
    "font-weight-medium": "500",
    "font-weight-semibold": "600",
    "font-weight-bold": "700",
    "letter-spacing-display": "-0.018em",
    "letter-spacing-title": "-0.01em",
    "letter-spacing-label": "0.015em",
    "letter-spacing-mono": "-0.01em",
    "space-0": "0",
    "space-1": "4px",
    "space-2": "8px",
    "space-3": "12px",
    "space-4": "16px",
    "space-5": "20px",
    "space-6": "24px",
    "space-8": "32px",
    "space-10": "40px",
    "control-height-small": "26px",
    "control-height": "30px",
    "list-row-height": "36px",
    "radius-control": "5px",
    "radius-card": "8px",
    "radius-panel": "10px",
    "radius-modal": "14px",
    "radius-round": "999px",
    "border-width": "1px",
    "border-width-focus": "2px",
    "elevation-none": "none",
    "elevation-card": "0 1px 2px var(--lc-shadow-color)",
    "elevation-popover": "0 8px 24px var(--lc-shadow-color), 0 2px 6px var(--lc-shadow-color-tight)",
    "elevation-panel": "0 16px 48px var(--lc-shadow-color), 0 4px 12px var(--lc-shadow-color-tight)",
    "focus-ring": "0 0 0 1px var(--lc-color-surface), 0 0 0 3px var(--lc-accent-human)",
    "motion-duration-hover": "80ms",
    "motion-duration-state": "120ms",
    "motion-duration-panel": "150ms",
    "motion-duration-agent-pulse": "900ms",
    "motion-agent-pulse-iterations": "2",
    "motion-ease-standard": "cubic-bezier(0.2, 0, 0, 1)",
    "motion-ease-exit": "cubic-bezier(0.4, 0, 1, 1)",
    "opacity-disabled": "0.48",
    "icon-size-xs": "12px",
    "icon-size-small": "14px",
    "icon-size": "16px",
    "icon-size-large": "20px",
    "icon-size-brand": "24px",
    "icon-stroke": "1.5",
    "icon-stroke-emphasis": "1.75",
    "icon-grid": "16",
    "z-base": "0",
    "z-sticky": "10",
    "z-panel": "30",
    "z-modal": "50",
    "z-toast": "70"
  },
  "appearances": {
    "light": {
      "color-canvas": "#F4F5F8",
      "color-surface": "#FFFFFF",
      "color-surface-subtle": "#F8F8FB",
      "color-surface-raised": "#FFFFFF",
      "color-surface-hover": "#EFF1F6",
      "color-text": "#171923",
      "color-text-secondary": "#4C5165",
      "color-text-muted": "#636A7C",
      "color-text-inverse": "#FFFFFF",
      "color-border": "#E3E5EE",
      "color-border-strong": "#858B9D",
      "color-scrim": "rgba(15, 16, 21, 0.38)",
      "color-warning": "#945A00",
      "color-warning-soft": "#FFF3D6",
      "color-danger": "#C63E49",
      "color-danger-soft": "#FFF2F3",
      "color-info": "#2E63A3",
      "color-info-soft": "#EAF1FA",
      "color-status-backlog": "#636B7D",
      "color-status-todo": "#4F6785",
      "color-status-in-progress": "#946000",
      "color-status-in-review": "#A84B20",
      "color-status-done": "#5C50C9",
      "color-status-canceled": "#656B78",
      "color-priority-urgent": "#C63E49",
      "color-priority": "#535A6D",
      "color-priority-muted": "#8A90A2",
      "color-label-slate-fg": "#53596B",
      "color-label-slate-bg": "#EFF0F4",
      "color-label-blue-fg": "#315F9B",
      "color-label-blue-bg": "#E8F0FA",
      "color-label-cyan-fg": "#006A79",
      "color-label-cyan-bg": "#E4F5F7",
      "color-label-violet-fg": "#6245A1",
      "color-label-violet-bg": "#F0EBFA",
      "color-label-magenta-fg": "#853B75",
      "color-label-magenta-bg": "#F8EAF3",
      "color-label-rose-fg": "#934153",
      "color-label-rose-bg": "#FAECEF",
      "color-label-orange-fg": "#8D4B22",
      "color-label-orange-bg": "#FAEEE6",
      "color-label-gold-fg": "#776000",
      "color-label-gold-bg": "#F7F1D8",
      "shadow-color": "rgba(23, 25, 35, 0.10)",
      "shadow-color-tight": "rgba(23, 25, 35, 0.07)"
    },
    "dark": {
      "color-canvas": "#0F1015",
      "color-surface": "#16171E",
      "color-surface-subtle": "#191B23",
      "color-surface-raised": "#1C1E27",
      "color-surface-hover": "#222530",
      "color-text": "#E9EAF2",
      "color-text-secondary": "#A6AABC",
      "color-text-muted": "#8B90A5",
      "color-text-inverse": "#0F1015",
      "color-border": "#262935",
      "color-border-strong": "#646A7E",
      "color-scrim": "rgba(0, 0, 0, 0.62)",
      "color-warning": "#E4B456",
      "color-warning-soft": "#342B19",
      "color-danger": "#F07B82",
      "color-danger-soft": "#3A2227",
      "color-info": "#83B3E5",
      "color-info-soft": "#1D2B3D",
      "color-status-backlog": "#9BA1B2",
      "color-status-todo": "#8EADD1",
      "color-status-in-progress": "#E6B94E",
      "color-status-in-review": "#F19A65",
      "color-status-done": "#A8A0FF",
      "color-status-canceled": "#9095A5",
      "color-priority-urgent": "#F07B82",
      "color-priority": "#A2A7B9",
      "color-priority-muted": "#686E82",
      "color-label-slate-fg": "#B6BBCB",
      "color-label-slate-bg": "#2B2D37",
      "color-label-blue-fg": "#91B7E7",
      "color-label-blue-bg": "#1E2C3F",
      "color-label-cyan-fg": "#75C8D3",
      "color-label-cyan-bg": "#16363B",
      "color-label-violet-fg": "#BCA2EB",
      "color-label-violet-bg": "#302741",
      "color-label-magenta-fg": "#D69BC7",
      "color-label-magenta-bg": "#40283A",
      "color-label-rose-fg": "#E3A1AD",
      "color-label-rose-bg": "#432A30",
      "color-label-orange-fg": "#E7AA7A",
      "color-label-orange-bg": "#422F25",
      "color-label-gold-fg": "#D8C46B",
      "color-label-gold-bg": "#3B351E",
      "shadow-color": "rgba(0, 0, 0, 0.34)",
      "shadow-color-tight": "rgba(0, 0, 0, 0.24)"
    }
  },
  "themes": {
    "indigo": {
      "label": "Indigo",
      "description": "Default. Focused, technical, and closest to the approved reference.",
      "light": {
        "accent-human": "#4938D0",
        "accent-human-hover": "#3D2DB7",
        "accent-human-active": "#34269C",
        "accent-human-soft": "#EFEDFF",
        "accent-human-soft-hover": "#E4E1FF",
        "accent-human-border": "#C6C1FA",
        "accent-human-on-solid": "#FFFFFF",
        "accent-agent": "#147A50",
        "accent-agent-hover": "#0F6944",
        "accent-agent-active": "#0B5939",
        "accent-agent-soft": "#E5F5ED",
        "accent-agent-soft-hover": "#E0F0E7",
        "accent-agent-border": "#A9D8C1",
        "accent-agent-on-solid": "#FFFFFF"
      },
      "dark": {
        "accent-human": "#9A92FF",
        "accent-human-hover": "#ABA5FF",
        "accent-human-active": "#BCB7FF",
        "accent-human-soft": "#292642",
        "accent-human-soft-hover": "#333052",
        "accent-human-border": "#57518A",
        "accent-human-on-solid": "#0F1015",
        "accent-agent": "#65D39A",
        "accent-agent-hover": "#77DDA7",
        "accent-agent-active": "#8AE4B5",
        "accent-agent-soft": "#173629",
        "accent-agent-soft-hover": "#1D4332",
        "accent-agent-border": "#326D50",
        "accent-agent-on-solid": "#0F1015"
      }
    },
    "clay": {
      "label": "Clay",
      "description": "Warm and grounded; retained from the approved Clay exploration.",
      "light": {
        "accent-human": "#83301A",
        "accent-human-hover": "#712716",
        "accent-human-active": "#5F2012",
        "accent-human-soft": "#FBEDE8",
        "accent-human-soft-hover": "#F7DDD4",
        "accent-human-border": "#E7B6A6",
        "accent-human-on-solid": "#FFFFFF",
        "accent-agent": "#147A50",
        "accent-agent-hover": "#0F6944",
        "accent-agent-active": "#0B5939",
        "accent-agent-soft": "#E5F5ED",
        "accent-agent-soft-hover": "#E0F0E7",
        "accent-agent-border": "#A9D8C1",
        "accent-agent-on-solid": "#FFFFFF"
      },
      "dark": {
        "accent-human": "#C96852",
        "accent-human-hover": "#D77A64",
        "accent-human-active": "#E38B76",
        "accent-human-soft": "#211817",
        "accent-human-soft-hover": "#241917",
        "accent-human-border": "#75493C",
        "accent-human-on-solid": "#0F1015",
        "accent-agent": "#65D39A",
        "accent-agent-hover": "#77DDA7",
        "accent-agent-active": "#8AE4B5",
        "accent-agent-soft": "#173629",
        "accent-agent-soft-hover": "#1D4332",
        "accent-agent-border": "#326D50",
        "accent-agent-on-solid": "#0F1015"
      }
    },
    "azure": {
      "label": "Azure",
      "description": "Cool and open without borrowing the default theme's violet cast.",
      "light": {
        "accent-human": "#005080",
        "accent-human-hover": "#00466F",
        "accent-human-active": "#003B5E",
        "accent-human-soft": "#E6F4FB",
        "accent-human-soft-hover": "#D5ECF7",
        "accent-human-border": "#A5D2E8",
        "accent-human-on-solid": "#FFFFFF",
        "accent-agent": "#147A50",
        "accent-agent-hover": "#0F6944",
        "accent-agent-active": "#0B5939",
        "accent-agent-soft": "#E5F5ED",
        "accent-agent-soft-hover": "#E0F0E7",
        "accent-agent-border": "#A9D8C1",
        "accent-agent-on-solid": "#FFFFFF"
      },
      "dark": {
        "accent-human": "#3E9DC9",